{
  "artifact_type": "deployment_readiness_report",
  "schema_version": "2026-05-20",
  "mode": "production",
  "status": "blocked_for_production",
  "blocking_checks": [
    "postgres_source_of_truth",
    "migration_ledger",
    "restore_automation",
    "packaged_deployment_ownership",
    "nats_propagation",
    "managed_key_material",
    "managed_signing_custody",
    "custody_audit_export",
    "runtime_safety_provider",
    "scanner_decision_persistence",
    "worker_operations_evidence",
    "operator_runbooks"
  ],
  "warning_checks": [],
  "checks": [
    {
      "id": "postgres_source_of_truth",
      "layer": "Source of truth",
      "title": "Postgres trust-state store",
      "status": "block",
      "evidence": "Production source-of-truth database is not configured.",
      "remediation": "Configure a dedicated QR Trust Postgres database and keep publisher or other app databases separate."
    },
    {
      "id": "migration_ledger",
      "layer": "Schema ownership",
      "title": "Migration ledger gate",
      "status": "block",
      "evidence": "Migration ledger gate is not enabled.",
      "remediation": "Apply and verify reference migrations through the migration ledger before workers write state."
    },
    {
      "id": "restore_automation",
      "layer": "Operations",
      "title": "Backup and restore automation",
      "status": "block",
      "evidence": "Restore automation is not documented.",
      "remediation": "Add backup execution, restore drill, and rollback ownership before production deployment."
    },
    {
      "id": "packaged_deployment_ownership",
      "layer": "Operations",
      "title": "Packaged deployment ownership",
      "status": "block",
      "evidence": "Packaged deployment ownership is not documented.",
      "remediation": "Assign owners for deployable artifacts, image provenance, release approval, environment promotion, and rollback before production deployment."
    },
    {
      "id": "nats_propagation",
      "layer": "Propagation",
      "title": "NATS JetStream propagation",
      "status": "block",
      "evidence": "NATS propagation URL is not configured.",
      "remediation": "Configure NATS JetStream for propagation after Postgres-backed artifacts are durable."
    },
    {
      "id": "managed_key_material",
      "layer": "Verifier cache",
      "title": "Managed public-key material source",
      "status": "block",
      "evidence": "Managed key-material provider is not configured.",
      "remediation": "Wire KMS, HSM, or another managed source for public verification material references."
    },
    {
      "id": "managed_signing_custody",
      "layer": "Artifact issuance",
      "title": "Managed signing custody",
      "status": "block",
      "evidence": "Managed signing custody provider is not configured.",
      "remediation": "Move artifact signing into a managed KMS or HSM custody provider before production issuance."
    },
    {
      "id": "custody_audit_export",
      "layer": "Artifact issuance",
      "title": "Custody audit export",
      "status": "block",
      "evidence": "Custody audit export is not configured.",
      "remediation": "Export signing custody audit events to an operator-owned audit trail."
    },
    {
      "id": "runtime_safety_provider",
      "layer": "Scan-time safety",
      "title": "Live runtime-safety provider",
      "status": "block",
      "evidence": "Live runtime-safety provider is not configured.",
      "remediation": "Configure a live safe-browsing, reputation, redirect, or TLS inspector with privacy boundaries."
    },
    {
      "id": "scanner_decision_persistence",
      "layer": "Scanner decision",
      "title": "Scanner-visible decision persistence",
      "status": "block",
      "evidence": "Scanner decision persistence is enabled. Evidence references are missing.",
      "remediation": "Persist scanner-visible green, orange, and red outcomes for audit and review."
    },
    {
      "id": "worker_operations_evidence",
      "layer": "Operations",
      "title": "Worker operations evidence packet",
      "status": "block",
      "evidence": "Worker operations evidence packet is not configured.",
      "remediation": "Attach a worker operations evidence packet before claiming production readiness."
    },
    {
      "id": "operator_runbooks",
      "layer": "Operations",
      "title": "Operator runbooks",
      "status": "block",
      "evidence": "Operator runbooks are not documented.",
      "remediation": "Document issuance, key rotation, provider outage, worker recovery, and rollback procedures."
    }
  ]
}
